,id,PMID Link,DOI Link,PMID,DOI,Title,Abstract,Authors,Affiliations,Year,Date,Journal,Citations
0,0,"""https://pubmed.ncbi.nlm.nih.gov/37466938""","""http://www.ncbi.nlm.nih.gov/pmc/articles/pmc10357333/""","""37466938""","""PMC10357333""","""The Effect of Racial Concordance on Patient Trust in Online Videos About Prostate Cancer: A Randomized Clinical Trial""","""Importance:   Black men have a higher risk of prostate cancer compared with White men, but Black adults are underrepresented in online content about prostate cancer. Across racial groups, the internet is a popular source of health information; Black adults are more likely to trust online health information, yet have more medical mistrust than White adults.  Objective:   To evaluate the association between racial representation in online content about prostate cancer and trust in the content and identify factors that influence trust.  Design, setting, and participants:   A randomized clinical trial was conducted from August 18, 2021, to January 7, 2022, consisting of a 1-time online survey. Participants included US men and women aged 40 years and older. Data were analyzed from January 2022 to June 2023.  Interventions:   Participants were randomized to watch the same video script about either prostate cancer screening or clinical trials presented by 1 of 4 speakers: a Black physician, a Black patient, a White physician, or a White patient, followed by a questionnaire.  Main outcomes and measures:   The primary outcome was a published scale for trust in the information. χ2 tests and multivariable logistic regression were used to compare trust according to the video's speaker and topic.  Results:   Among 2904 participants, 1801 (62%) were men, and the median (IQR) age was 59 (47-69) years. Among 1703 Black adults, a greater proportion had high trust in videos with Black speakers vs White speakers (72.7% vs 64.3%; adjusted odds ratio [aOR], 1.62; 95% CI, 1.28-2.05; P < .001); less trust with patient vs physician presenter (64.6% vs 72.5%; aOR, 0.63; 95% CI, 0.49-0.80; P < .001) and about clinical trials vs screening (66.3% vs 70.7%; aOR, 0.78; 95% CI, 0.62-0.99; P = .04). Among White adults, a lower proportion had high trust in videos featuring a patient vs physician (72.0% vs 78.6%; aOR, 0.71; 95% CI, 0.54-0.95; P = .02) and clinical trials vs screening (71.4% vs 79.1%; aOR, 0.57; 95% CI, 0.42-0.76; P < .001), but no difference for Black vs White presenters (76.8% vs 73.7%; aOR, 1.11; 95% CI, 0.83-1.48; P = .49).  Conclusions and relevance:   In this randomized clinical trial, prostate cancer information was considered more trustworthy when delivered by a physician, but racial concordance was significantly associated with trust only among Black adults. These results highlight the importance of physician participation and increasing racial diversity in public dissemination of health information and an ongoing need for public education about clinical trials.  Trial registration:   ClinicalTrials.gov Identifier: NCT05886751.""","""['Stacy Loeb', 'Joseph E Ravenell', 'Scarlett Lin Gomez', 'Hala T Borno', 'Katherine Siu', 'Tatiana Sanchez Nolasco', 'Nataliya Byrne', 'Godfrey Wilson', 'Derek M Griffith', 'Rob Crocker', 'Robert Sherman', 'Samuel L Washington rd', 'Aisha T Langford']""","""[]""","""2023""","""None""","""JAMA Netw Open""","""['Exploring the Association Between Online Health Information and Racial Disparities in Prostate Cancer.']"""
0,0,"""https://pubmed.ncbi.nlm.nih.gov/37465665""","""http://www.ncbi.nlm.nih.gov/pmc/articles/pmc10350564/""","""37465665""","""PMC10350564""","""Cyto-IL-15 synergizes with the STING agonist ADU-S100 to eliminate prostate tumors and confer durable immunity in mouse models""","""Introduction:   Prostate cancer is one of the most commonly diagnosed malignancies in men with high mortality rates. Despite the recent therapeutic advances, such as immunotherapies, survival of patients with advance disease remains significantly low. Blockade of immune checkpoints has led to low response rates in these patients probably due to the immunosuppressive microenvironment and low mutation burden of prostate tumors. Combination of multiple immunotherapeutic regimes has also been unsatisfactory due to augmented adverse effects. To activate multiple immune-stimulatory pathways in the hostile prostate cancer microenvironment, we used a combination of cytotopically modified interleukin-15 (cyto-IL-15) with the stimulator of interferon genes (STING) agonist, ADU-S100.  Methods:   To determine whether this combination regime could lead to both local and systemic anti-tumor effects, intratumoral administration of these agents was used in murine models of prostate cancer. Tumor growth and mouse survival were monitored, and ex vivo analyses, and RNA sequencing were performed on the tumors.  Results:   Intratumorally injected ADU-S100 and cyto-IL-15 synergized to eliminate tumors in 58-67% of mice with unilateral tumors and promoted abscopal immunity in 50% of mice with bilateral tumors treated only at one side. Moreover, this combination regime offered immunoprotection against tumor rechallenge in 83% of cured mice. The efficacy of the combination treatment was associated with a strong innate and adaptive immune activation and induction of apoptotic and necrotic cell death. Cytokines, including type I and II interferons, and cytokine signalling pathways were activated, NK and T cell mediated cytotoxicity was increased, and B cells were activated both locally and systemically. While ADU-S100 led to an ulcerative pathology at the injection site, no other adverse effects were observed.  Discussion:   Localised administration of a STING agonist together with cyto-IL-15 can confer significant systemic benefits and long-lasting immunity against prostate tumors while reducing immune related toxicities.""","""['Efthymia Papaevangelou', 'Ana M Esteves', 'Prokar Dasgupta', 'Christine Galustian']""","""[]""","""2023""","""None""","""Front Immunol""","""[]"""
0,0,"""https://pubmed.ncbi.nlm.nih.gov/37465571""","""http://www.ncbi.nlm.nih.gov/pmc/articles/pmc10350636/""","""37465571""","""PMC10350636""","""Highly selective optical sensor N/S-doped carbon quantum dots (CQDs) for the assessment of human chorionic gonadotropin β-hCG in the serum of breast and prostate cancer patients""","""A low-cost, accurate, and highly selective method was used for the assessment of the human chorionic gonadotropin β-hCG in the serum of breast and prostate cancer patients. This method is based on enhancing the intensity of luminescence displayed by the optical sensor N/S-doped carbon dots (CQDs) upon adding different concentrations of β-hCG. The luminescent optical sensor was synthesized and characterized through absorption and emission and is tailored to present blue luminescence at λem = 345 nm and λex = 288 nm at pH 7.8 in DMSO. The enhancement of the luminescence intensity of the N/S-doped CQDs, especially, the characteristic band at λem = 345 nm, is typically used for determining β-hCG in different serum samples. The dynamic range is 1.35-22.95 mU mL-1, and the limit of detection (LOD) and quantitation limit of detection (LOQ) are 0.235 and 0.670 mU mL-1, respectively. This method was practical, simple, and relatively free from interference effect. It was successfully applied to measure PCT in the samples of human serum, and from this method, we can assess some biomarkers of cancer-related diseases in human body.""","""['Yasmeen M AlZahrani', 'Salha Alharthi', 'Hind A AlGhamdi', 'A O Youssef', 'Shahenda S Ahmed', 'Ekram H Mohamed', 'Safwat A Mahmoud', 'Mohamed S Attia']""","""[]""","""2023""","""None""","""RSC Adv""","""[]"""
0,0,"""https://pubmed.ncbi.nlm.nih.gov/37464331""","""http://www.ncbi.nlm.nih.gov/pmc/articles/pmc10354960/""","""37464331""","""PMC10354960""","""How education level affects postoperative rehabilitation and follow-up: a single-center experience""","""Background:   Radical prostatectomy remains the fundamental treatment for prostate cancer, and improving patients' compliance with postoperative follow-ups is essential for improving patients' quality of life. This study investigates the effect of education levels on patients' recovery and follow-up after radical prostatectomy.  Methods:   Data from 1,112 patients undergoing radical prostatectomy between 2011 and 2020 were collected using medical records, and ""pc-follow"" systems were used to collect patients' baseline information, education level, pathological information, number of outpatient visits, the time interval between each visit, and PSA test data.  Results:   Regarding postoperative outpatient data, there was no difference in the number of outpatient visits among the different education level groups in Shanghai (P = 0.063). A significant difference was found in the interval between outpatient visits among the groups (P < 0.001). Furthermore, significant differences were detected in the number and duration of outpatient clinic visits among the education level groups in all patients (P = 0.016, P = 0.0027). By contrast, no significant difference was found in the recovery time of urinary continence between all patients and those in Shanghai, grouped according to education level (P = 0.082, P = 0.68). For all patients and patients in the Shanghai area, the number of PSA follow-ups increased gradually with an increasing level of education (P < 0.001, P = 0.0029).  Conclusions:   Education level affected the number of postoperative clinic visits, compliance, and the number of PSA tests. However, no significant effect on the recovery of urinary continence was found. Further, clinicians must increase their focus on patients with low education levels to achieve equitable access to health services for all patients.""","""['Jin Ji#', 'Yuchen Yang#', 'Zeyu Chen#', 'Wenhui Zhang', 'Shaoqin Jiang', 'Xianqi Shen', 'Jili Zhang', 'Lu Lin', 'Min Qu', 'Yan Wang', 'Xu Gao']""","""[]""","""2023""","""None""","""BMC Urol""","""[]"""
0,0,"""https://pubmed.ncbi.nlm.nih.gov/37464317""","""http://www.ncbi.nlm.nih.gov/pmc/articles/pmc10353248/""","""37464317""","""PMC10353248""","""SNHG1 opposes quiescence and promotes docetaxel sensitivity in prostate cancer""","""Background:   A majority of prostate cancer cells are in a non-proliferating, G0 (quiescent) phase of the cell cycle and may lie dormant for years before activation into a proliferative, rapidly progressing, disease phase. Many mechanisms which influence proliferation and quiescence choices remain to be elucidated, including the role of non-coding RNAs. In this study, we investigated the role of a long non-coding RNA (lncRNA), SNHG1, on cell proliferation, quiescence, and sensitivity to docetaxel as a potential factor important in prostate cancer biology.  Methods:   Publically available, anonymous, clinical data was obtained from cBioPortal for analysis. RNAi and prostate cancer cell lines were utilized to investigate SNHG1 in vitro. We measured G0 cells, DNA synthesis, and cell cycle distribution by flow cytometry. Western blotting was used to assess G2 arrest and apoptosis. These parameters were also investigated following docetaxel treatment.  Results:   We discovered that in prostate cancer patients from The Cancer Genome Atlas (TCGA) data set, high SNHG1 expression in localized tumors correlated with reduced progression-free survival, and in a data set of both primary and metastatic tumors, high SNHG1 expression was associated with metastatic tumors. In vitro analysis of prostate cancer cell lines showed SNHG1 expression correlated with a quiescent versus proliferative phenotype. Knockdown of SNHG1 by RNAi in PC3 and C4-2B cells resulted in an accumulation of cells in the G0 phase. After knockdown, 60.0% of PC3 cells were in G0, while control cultures had 13.2% G0. There were reciprocal decreases in G1 phase, but little impact on the proportion of cells in S and G2/M phases, depending on cell line. DNA synthesis and proliferation were largely halted- decreasing by 75% and 81% in C4-2B and PC3 cells, respectively. When cells were treated with docetaxel, SNHG1-depleted C4-2B and PC3 cells were resistant to G2 arrest, and displayed reduced apoptosis, as indicated by reduced cyclin B1 and cleaved caspase 3, suggesting SNHG1 levels may modulate drug response.  Conclusions:   Overall, these results indicate SNHG1 has complex roles in prostate cancer, as it stimulates cell cycle entry and disease progression, but sensitizes cells to docetaxel treatment.""","""['Steven P Zielske', 'Wei Chen', 'Kristina G Ibrahim', 'Frank C Cackowski']""","""[]""","""2023""","""None""","""BMC Cancer""","""[]"""
0,0,"""https://pubmed.ncbi.nlm.nih.gov/37463954""","""http://www.ncbi.nlm.nih.gov/pmc/articles/pmc10354070/""","""37463954""","""PMC10354070""","""Switching mechanism from AR to EGFR signaling via 3-O-sulfated heparan sulfate in castration-resistant prostate cancer""","""Androgen deprivation therapy is given to suppress prostate cancer growth; however, some cells continue to grow hormone-independently as castration-resistant prostate cancer (CRPC). Sulfated glycosaminoglycans promote ligand binding to receptors as co-receptors, but their role in CRPC remains unknown. Using the human prostate cancer cell line C4-2, which can proliferate in hormone-dependent and hormone-independent conditions, we found that epidermal growth factor (EGF)-activated EGFR-ERK1/2 signaling via 3-O-sulfated heparan sulfate (HS) produced by HS 3-O-sulfotransferase 1 (HS3ST1) is activated in C4-2 cells under hormone depletion. Knockdown of HS3ST1 in C4-2 cells suppressed hormone-independent growth, and inhibited both EGF binding to the cell surface and activation of EGFR-ERK1/2 signaling. Gefitinib, an EGFR inhibitor, significantly suppressed C4-2 cell proliferation and growth of a xenografted C4-2 tumor in castrated mouse. Collectively, our study has revealed a mechanism by which cancer cells switch to hormone-independent growth and identified the key regulator as 3-O-sulfated HS.""","""['Hayato Ota', 'Hirokazu Sato', 'Shuji Mizumoto', 'Ken Wakai', 'Kei Yoneda', 'Kazuo Yamamoto', 'Hayao Nakanishi', 'Jun-Ichiro Ikeda', 'Shinichi Sakamoto', 'Tomohiko Ichikawa', 'Shuhei Yamada', 'Satoru Takahashi', 'Yuzuru Ikehara', 'Shoko Nishihara']""","""[]""","""2023""","""None""","""Sci Rep""","""[]"""
0,0,"""https://pubmed.ncbi.nlm.nih.gov/37463944""","""http://www.ncbi.nlm.nih.gov/pmc/articles/pmc10354194/""","""37463944""","""PMC10354194""","""MR imaging features to predict the type of bone metastasis in prostate cancer""","""Bone metastases (BMs) of prostate cancer (PCa) have been considered predominantly osteoblastic, but non-osteoblastic (osteolytic or mixed osteoblastic and osteolytic) BMs can occur. We investigated the differences in prostate MRI and clinical findings between patients with osteoblastic and non-osteoblastic BMs. Between 2014 and 2021, patients with pathologically proven PCa without a history of other malignancies were included in this study. Age, Gleason score, prostate-specific antigen (PSA) density, normalized mean apparent diffusion coefficient and normalized T2 signal intensity (nT2SI) of PCa, and Prostate Imaging Reporting and Data System category on MRI were compared between groups. A multivariate logistic regression analysis using factors with P-values < 0.2 was performed to detect the independent parameters for predicting non-osteoblastic BM group. Twenty-five (mean 73 ± 6.6 years) and seven (69 ± 13.1 years) patients were classified into the osteoblastic and non-osteoblastic groups, respectively. PSA density and nT2SI were significantly higher in the non-osteoblastic group than in the osteoblastic group. nT2SI was an independent predictive factor for non-osteoblastic BMs in the multivariate logistic regression analysis. These results indicated that PCa patients with high nT2SI and PSA density should be examined for osteolytic BMs.""","""['Hiroaki Koyama', 'Ryo Kurokawa', 'Shimpei Kato', 'Masanori Ishida', 'Ryohei Kuroda', 'Tetsuo Ushiku', 'Haruki Kume', 'Osamu Abe']""","""[]""","""2023""","""None""","""Sci Rep""","""[]"""
0,0,"""https://pubmed.ncbi.nlm.nih.gov/37463778""","""http://www.ncbi.nlm.nih.gov/pmc/articles/pmc10357655/""","""37463778""","""PMC10357655""","""Adenocarcinoma involving the urinary bladder""","""A man in his 70s previously diagnosed with an adenocarcinoma of the prostate, received external beam radiation therapy (EBRT) and brachytherapy 11 years ago. Ten years later, he developed urinary symptoms and a cystoscopy identified a bladder neck tumour. A transurethral resection of a bladder tumour was performed, and pathology revealed a high-grade adenocarcinoma consistent with a colorectal primary. A colonoscopy was unremarkable, and imaging studies showed tumour involving the bladder and prostate. Tumour markers and a CARIS genomic prevalence score also favoured a colorectal cancer primary.The patient refused surgery and underwent chemoradiation with a combination of EBRT and brachytherapy with concurrent capecitabine. Imaging studies obtained 6 months after reirradiation revealed an enlarged left-sided mesorectal lymph node concerning for disease recurrence. The lymph node was treated with Stereotactic Body Radiation Therapy and his post-treatment imaging revealed a response to treatment with no other evidence of disease.""","""['Pule Wang', 'Michael Joiner', 'Stephen Dzul', 'Steven Raymond Miller']""","""[]""","""2023""","""None""","""BMJ Case Rep""","""[]"""
0,0,"""https://pubmed.ncbi.nlm.nih.gov/37463420""","""https://doi.org/10.33594/000000638""","""37463420""","""10.33594/000000638""","""Unprecedentedly High Level of Intracellular Vitamin C and DNA Epigenetic Marks in Prostate: Relevant for Male Fertility?""","""Background/aims:   Seminal plasma composition is affected by the physiological state of the prostate, the major male reproductive gland. Semen components, like vitamin C, can modulate sperm function. Vitamin C is an effective scavenger of free radicals and is an essential component of enzymes such as TET proteins involved in the DNA demethylation process. In the present study, a broad range of parameters which may influence the metabolic state of the prostate gland were analysed including blood and prostate tissue vitamin C, epigenetic DNA modifications and 8-oxo-7,8-dihydro-2'-deoxyguanosine in DNA of leukocytes and prostate tissues.  Methods:   The experimental material were tissue samples from patients with benign prostatic hyperplasia (BPH), normal/marginal prostate tissues from prostate cancer patients, leukocytes from healthy donors, and blood plasma from BPH patients and healthy donors. We applied ultra-performance liquid chromatography methods with mass spectrometry and/or UV detection.  Results:   We found an unprecedentedly high level of intracellular vitamin C in all analysed prostatic tissues (benign prostatic hyperplasia and normal, marginal ones), a value much higher than in leukocytes and most human tissues. DNA epigenetic patterns in prostate cells are similar to other soft tissues like the colon, however, its uniqueness is the unprecedentedly high level of 5-(hydroxymethyl)-2'-deoxyuridine and a significant increase in 5-formyl-2'-deoxycytidine value compared to aforementioned tissues. Moreover, the level of 8-oxo-7,8-dihydro-2'-deoxyguanosine, an established marker of oxidative stress, is significantly higher in prostate tissues than in leukocytes and many previously studied soft tissues.  Conclusion:   Our results pointed out that prostatic vitamin C (regarded as the main supplier of the vitamin C to seminal plasma) and the DNA modifications (which may be linked to the regeneration of prostate epithelium) may play important role to maintain the prostate health.""","""['Jolanta Guz', 'Ewelina Zarakowska', 'Pawel Mijewski', 'Aleksandra Wasilow', 'Justyna Szpotan', 'Marek Foksinski', 'Bartosz Brzoszczyk', 'Daniel Gackowski', 'Piotr Jarzemski', 'Ryszard Olinski']""","""[]""","""2023""","""None""","""Cell Physiol Biochem""","""[]"""
0,0,"""https://pubmed.ncbi.nlm.nih.gov/37463336""","""http://www.ncbi.nlm.nih.gov/pmc/articles/pmc10355676/""","""37463336""","""PMC10355676""","""Fictitious cases as a methodology to discuss sensitive health topics in focus groups""","""Purpose:   It can be challenging to research aspects of people's health behaviour, attitudes, and emotions due to the sensitive nature of these topics. We aimed to develop a novel methodology for discussing sensitive health topics, and explore the effectiveness in focus groups using prostate cancer and screening as an example.  Method:   We developed a fictitious case and employed it as a projective technique in focus groups on prostate cancer and screening. The participants were men and their partners who lived in Denmark.  Results:   The technique encouraged emotional and cognitive openness in focus group discussions about the risk of prostate cancer, the benefits and harms of screening, and decision-making about screening. It appeared that using the fictitious case allowed the participants to personally distance themselves from the topic, project emotions onto the case, and thereby openly talk about their emotions.  Conclusion:   This article presents a methodological contribution to communication about sensitive topics in focus groups, using prostate cancer screening as an example. Further refinement of the methodology is needed to enable participants to transfer improvements in knowledge to their own decision about screening.""","""['Emma Grundtvig Gram', 'John Brandt Brodersen', 'Cæcilie Hansen', 'Kristen Pickles', 'Jenna Smith', 'Alexandra Ryborg Brandt Jønsson']""","""[]""","""2023""","""None""","""Int J Qual Stud Health Well-being""","""[]"""
0,0,"""https://pubmed.ncbi.nlm.nih.gov/37463144""","""http://www.ncbi.nlm.nih.gov/pmc/articles/pmc10353799/""","""37463144""","""PMC10353799""","""Cleavage of the V-ATPase associated prorenin receptor is mediated by PACE4 and is essential for growth of prostate cancer cells""","""Phosphatase and tensin homolog (PTEN) mutation is common in prostate cancer during progression to metastatic and castration resistant forms. We previously reported that loss of PTEN function in prostate cancer leads to increased expression and secretion of the Prorenin Receptor (PRR) and its soluble processed form, the soluble Prorenin Receptor (sPRR). PRR is an essential factor required for proper assembly and activity of the vacuolar-ATPase (V-ATPase). The V-ATPase is a rotary proton pump required for the acidification of intracellular vesicles including endosomes and lysosomes. Acidic vesicles are involved in a wide range of cancer related pathways such as receptor mediated endocytosis, autophagy, and cell signalling. Full-length PRR is cleaved at a conserved consensus motif (R-X-X-R↓) by a member of the proprotein convertase family to generate sPRR, and a smaller C-terminal fragment, designated M8.9. It is unclear which convertase processes PRR in prostate cancer cells and how processing affects V-ATPase activity. In the current study we show that PRR is predominantly cleaved by PACE4, a proprotein convertase that has been previously implicated in prostate cancer. We further demonstrate that PTEN controls PRR processing in mouse tissue and controls PACE4 expression in prostate cancer cells. Furthermore, we demonstrate that PACE4 cleavage of PRR is needed for efficient V-ATPase activity and prostate cancer cell growth. Overall, our data highlight the importance of PACE4-mediated PRR processing in normal physiology and prostate cancer tumorigenesis.""","""['Amro H Mohammad', 'Frédéric Couture', 'Isabelle Gamache', 'Owen Chen', 'Wissal El-Assaad', 'Nelly Abdel-Malak', 'Anna Kwiatkowska', 'William Muller', 'Robert Day', 'Jose G Teodoro']""","""[]""","""2023""","""None""","""PLoS One""","""[]"""
