,id,PMID Link,DOI Link,PMID,DOI,Title,Abstract,Authors,Affiliations,Year,Date,Journal,Citations
0,0,"""https://pubmed.ncbi.nlm.nih.gov/37404109""","""http://www.ncbi.nlm.nih.gov/pmc/articles/pmc10323418/""","""37404109""","""PMC10323418""","""Nomogram Models for Distinguishing Intraductal Carcinoma of the Prostate From Prostatic Acinar Adenocarcinoma Based on Multiparametric Magnetic Resonance Imaging""","""Objective:   To compare multiparametric magnetic resonance imaging (MRI) features of intraductal carcinoma of the prostate (IDC-P) with those of prostatic acinar adenocarcinoma (PAC) and develop prediction models to distinguish IDC-P from PAC and IDC-P with a high proportion (IDC ≥ 10%, hpIDC-P) from IDC-P with a low proportion (IDC < 10%, lpIDC-P) and PAC.  Materials and methods:   One hundred and six patients with hpIDC-P, 105 with lpIDC-P and 168 with PAC, who underwent pretreatment multiparametric MRI between January 2015 and December 2020 were included in this study. Imaging parameters, including invasiveness and metastasis, were evaluated and compared between the PAC and IDC-P groups as well as between the hpIDC-P and lpIDC-P subgroups. Nomograms for distinguishing IDC-P from PAC, and hpIDC-P from lpIDC-P and PAC, were made using multivariable logistic regression analysis. The discrimination performance of the models was assessed using the receiver operating characteristic area under the curve (ROC-AUC) in the sample, where the models were derived from without an independent validation sample.  Results:   The tumor diameter was larger and invasive and metastatic features were more common in the IDC-P than in the PAC group (P < 0.001). The distribution of extraprostatic extension (EPE) and pelvic lymphadenopathy was even greater, and the apparent diffusion coefficient (ADC) ratio was lower in the hpIDC-P than in the lpIDC-P group (P < 0.05). The ROC-AUCs of the stepwise models based solely on imaging features for distinguishing IDC-P from PAC and hpIDC-P from lpIDC-P and PAC were 0.797 (95% confidence interval, 0.750-0.843) and 0.777 (0.727-0.827), respectively.  Conclusion:   IDC-P was more likely to be larger, more invasive, and more metastatic, with obviously restricted diffusion. EPE, pelvic lymphadenopathy, and a lower ADC ratio were more likely to occur in hpIDC-P, and were also the most useful variables in both nomograms for predicting IDC-P and hpIDC-P.""","""['Ling Yang#', 'Xue-Ming Li#', 'Meng-Ni Zhang', 'Jin Yao', 'Bin Song']""","""[]""","""2023""","""None""","""Korean J Radiol""","""[]"""
0,0,"""https://pubmed.ncbi.nlm.nih.gov/37404070""","""http://www.ncbi.nlm.nih.gov/pmc/articles/pmc10387937/""","""37404070""","""PMC10387937""","""Health-related quality of life in GALAHAD: A multicenter, open-label, phase 2 study of niraparib for patients with metastatic castration-resistant prostate cancer and DNA-repair gene defects""","""BACKGROUND: Niraparib is a highly selective poly (adenosine diphosphateribose) polymerase-1 and poly (adenosine diphosphate-ribose) polymerase-2 inhibitor indicated for select patients with ovarian, fallopian tube, and primary peritoneal cancer. The phase 2 GALAHAD trial (NCT02854436) demonstrated that niraparib monotherapy is tolerable and efficacious in patients with metastatic castration-resistant prostate cancer (mCRPC) and homologous recombination repair (HRR) gene alterations, particularly those with breast cancer gene (BRCA) alterations who had progressed on prior androgen signaling inhibitor therapy and taxane-based chemotherapy. OBJECTIVE: To report the prespecified patient-reported outcomes analysis from GALAHAD. METHODS: Eligible patients with alterations to BRCA1 and/or BRCA2 (BRCA cohort) and with pathogenic alterations in other HRR genes (other HRR cohort) were enrolled and received niraparib 300 mg once daily. Patient-reported outcome instruments included the Functional Assessment of Cancer Therapy-Prostate and the Brief Pain Inventory-Short Form. Changes from baseline were compared using a mixed-effect model for repeated measures. RESULTS: On average, health-related quality of life (HRQoL) improved in the BRCA cohort by cycle 3 (mean change = 6.03; 95% CI = 2.76-9.29) and was maintained above baseline until cycle 10 (mean change = 2.84; 95% CI = -1.95 to 7.63), whereas the other HRR cohort showed no early change in HRQoL from baseline (mean change = -0.07; 95% CI = -4.69 to 4.55) and declined by cycle 10 (mean change = -5.10; 95% CI = -15.3 to 5.06). Median time to deterioration in pain intensity and pain interference could not be estimated in either cohort. CONCLUSIONS: Patients with advanced mCRPC and BRCA alterations treated with niraparib experienced more meaningful improvement in overall HRQoL, pain intensity, and pain interference compared with those with other HRR alterations. In this population of castrate, heavily pretreated patients with mCRPC and HRR alterations, stabilization, and improvement in HRQoL may be relevant to consider when making treatment decisions. DISCLOSURES: This work was supported by Janssen Research & Development, LLC (no grant number). Dr Smith has received grants and personal fees from Bayer, Amgen, Janssen, and Lilly; and has received personal fees from Astellas Pharma, Novartis, and Pfizer. Dr Sandhu has received grants from Amgen, Endocyte, and Genentech; has received grants and personal fees from AstraZeneca and Merck; and has received personal fees from Bristol Myers Squibb and Merck Serono. Dr George has received personal fees from the American Association for Cancer Research, Axess Oncology, Capio Biosciences, Constellation Pharma, EMD Serono, Flatiron, Ipsen, Merck Sharp & Dohme, Michael J. Hennessey Association, Millennium Medical Publishing, Modra Pharma, Myovant Sciences, Inc., NCI Genitourinary, Nektar Therapeutics, Physician Education Resource, Propella TX, RevHealth, LLC, and UroGPO; has received grants and personal fees from Astellas Pharma, AstraZeneca, Bristol Myers Squibb, and Pfizer; has received personal fees and nonfinancial support from Bayer and UroToday; has received grants from Calithera and Novartis; and has received grants, personal fees, and nonfinancial support from Exelixis, Inc., Sanofi, and Janssen Pharma. Dr Chi has received grants from Janssen during the conduct of the study; has received grants and personal fees from AstraZeneca, Bayer, Astellas Pharma, Novartis, Pfizer, POINT Biopharma, Roche, and Sanofi; and has received personal fees from Daiichi Sankyo, Merck, and Bristol Myers Squibb. Dr Saad has received grants, personal fees, and nonfinancial support from Janssen during the conduct of the study; and has received grants, personal fees, and nonfinancial support from AstraZeneca, Astellas Pharma, Pfizer, Bayer, Myovant, Sanofi, and Novartis. Dr Thiery-Vuillemin has received grants, personal fees, and nonfinancial support from Pfizer; has received personal fees and nonfinancial support from AstraZeneca, Janssen, Ipsen, Roche/Genentech, Merck Sharp & Dohme, and Astellas Pharma; and has received personal fees from Sanofi, Novartis, and Bristol Myers Squibb. Dr Olmos has received grants, personal fees, and nonfinancial support from AstraZeneca, Bayer, Janssen, and Pfizer; has received personal fees from Clovis, Daiichi Sankyo, and Merck Sharp & Dohme; and has received nonfinancial support from Astellas Pharma, F. Hoffman-LaRoche, Genentech, and Ipsen. Dr Danila has received research support from the US Department of Defense, the American Society of Clinical Oncology, the Prostate Cancer Foundation, Stand Up to Cancer, Janssen Research & Development, Astellas Pharma, Medivation, Agensys, Genentech, and CreaTV. Dr Gafanov has received grants from Janssen during the conduct of the study. Dr Castro has received grants from Janssen during the conduct of the study; has received grants and personal fees from Janssen, Bayer, AstraZeneca, and Pfizer; and has received personal fees from Astellas Pharma, Merck Sharp & Dohme, Roche, and Clovis. Dr Moon has received research funding from SeaGen, HuyaBio, Janssen, BMS, Aveo, Xencor, and has received personal fees from Axess Oncology, MJH, EMD Serono, and Pfizer. Dr Joshua has received nonfinancial support from Janssen; consulted or served in an advisory role for Neoleukin, Janssen Oncology, Ipsen, AstraZeneca, Sanofi, Noxopharm, IQvia, Pfizer, Novartis, Bristol Myers Squibb, Merck Serono, and Eisai; and received research funding from Bristol Myers Squibb, Janssen Oncology, Merck Sharp & Dohme, Mayne Pharma, Roche/Genentech, Bayer, MacroGenics, Lilly, Pfizer, AstraZeneca, and Corvus Pharmaceuticals. Drs Mason, Liu, Bevans, Lopez-Gitlitz, and Francis and Mr Espina are employees of Janssen Research & Development. Dr Mason owns stocks with Janssen. Dr Fizazi has participated in advisory boards and talks for Amgen, Astellas, AstraZeneca, Bayer, Clovis, Daiichi Sankyo, Janssen, MSD, Novartis/AAA, Pfizer, and Sanofi, with honoraria to his institution (Institut Gustave Roussy); has participated in advisory boards for, with personal honoraria from, Arvinas, CureVac, MacroGenics, and Orion. Study registration number: NCT02854436.""","""['Matthew R Smith', 'Shahneen Sandhu', 'Daniel J George', 'Kim Nguyen Chi', 'Fred Saad', 'Antoine Thiery-Vuillemin', 'Olaf Stàhl', 'David Olmos', 'Daniel C Danila', 'Rustem Gafanov', 'Elena Castro', 'Helen Moon', 'Anthony M Joshua', 'Gary E Mason', 'Byron M Espina', 'Yan Liu', 'Angela Lopez-Gitlitz', 'Peter Francis', 'Katherine B Bevans', 'Karim Fizazi']""","""[]""","""2023""","""None""","""J Manag Care Spec Pharm""","""[]"""
0,0,"""https://pubmed.ncbi.nlm.nih.gov/37403617""","""https://doi.org/10.1039/d3nr01571h""","""37403617""","""10.1039/d3nr01571h""","""Super-resolution imaging of antibody-conjugated biodegradable periodic mesoporous organosilica nanoparticles for targeted chemotherapy of prostate cancer""","""Biodegradable periodic mesoporous organosilica nanoparticles (nanoPMOs) are widely used as responsive drug delivery platforms for targeted chemotherapy of cancer. However, the evaluation of their properties such as surface functionality and biodegradability is still challenging, which has a significant impact on the efficiency of chemotherapy. In this study, we have applied direct stochastic optical reconstruction microscopy (dSTORM), a single-molecule super-resolution microscopy technique, to quantify the degradation of nanoPMOs triggered by glutathione and the multivalency of antibody-conjugated nanoPMOs. Subsequently, the effect of these properties on cancer cell targeting, drug loading and release capability, and anticancer activity is also studied. Due to the higher spatial resolution at the nanoscale, dSTORM imaging is able to reveal the structural properties (i.e., size and shape) of fluorescent and biodegradable nanoPMOs. The quantification of nanoPMOs' biodegradation using dSTORM imaging demonstrates their excellent structure-dependent degradation behavior at a higher glutathione concentration. The surface functionality of anti-M6PR antibody-conjugated nanoPMOs as quantified by dSTORM imaging plays a key role in prostate cancer cell labeling: oriented antibody is more effective than random ones, while high multivalency is also effective. The higher biodegradability and cancer cell-targeting properties of nanorods conjugated with oriented antibody (EAB4H) effectively deliver the anticancer drug doxorubicin to cancer cells, exhibiting potent anticancer effects.""","""['Pradip Das', 'Silvia Pujals', 'Lamiaa M A Ali', 'Magali Gary-Bobo', 'Lorenzo Albertazzi', 'Jean-Olivier Durand']""","""[]""","""2023""","""None""","""Nanoscale""","""[]"""
0,0,"""https://pubmed.ncbi.nlm.nih.gov/37403231""","""http://www.ncbi.nlm.nih.gov/pmc/articles/pmc10345477/""","""37403231""","""PMC10345477""","""Dietary Progesterone Contributes to Intratissue Levels of Progesterone in Male Mice""","""Progesterone serum levels have been identified as a potential predictor for treatment effect in men with advanced prostate cancer, which is an androgen-driven disease. Although progesterone is the most abundant sex steroid in orchiectomized (ORX) male mice, the origins of progesterone in males are unclear. To determine the origins of progesterone and androgens, we first determined the effect of ORX, adrenalectomy (ADX), or both (ORX + ADX) on progesterone levels in multiple male mouse tissues. As expected, intratissue androgen levels were mainly testicular derived. Interestingly, progesterone levels remained high after ORX and ORX + ADX with the highest levels in white adipose tissue and in the gastrointestinal tract. High progesterone levels were observed in mouse chow and exceptionally high progesterone levels were observed in food items such as dairy, eggs, and beef, all derived from female animals of reproductive age. To determine if orally ingested progesterone contributes to tissue levels of progesterone in males, we treated ORX + ADX and sham mice with isotope-labeled progesterone or vehicle by oral gavage. We observed a significant uptake of labeled progesterone in white adipose tissue and prostate, suggesting that dietary progesterone may contribute to tissue levels of progesterone. In conclusion, although adrenal-derived progesterone contributes to intratissue progesterone levels in males, nonadrenal progesterone sources also contribute. We propose that dietary progesterone is absorbed and contributes to intratissue progesterone levels in male mice. We speculate that food with high progesterone content could be a significant source of progesterone in males, possibly with consequences for men undergoing androgen deprivation therapy for prostate cancer.""","""['Hannah Colldén', 'Malin Hagberg Thulin', 'Andreas Landin', 'Karin Horkeby', 'Marie Lagerquist', 'Jianyao Wu', 'Karin H Nilsson', 'Louise Grahnemo', 'Matti Poutanen', 'Henrik Ryberg', 'Liesbeth Vandenput', 'Claes Ohlsson']""","""[]""","""2023""","""None""","""Endocrinology""","""[]"""
0,0,"""https://pubmed.ncbi.nlm.nih.gov/37430353""","""http://www.ncbi.nlm.nih.gov/pmc/articles/pmc10332063/""","""37430353""","""PMC10332063""","""A multicentre randomised controlled trial of a guided self-help cognitive behavioural therapy to MANage the impact of hot flushes and night sweats in patients with prostate CANcer undergoing androgen deprivation therapy (MANCAN2)""","""Background:   Androgen deprivation therapy (ADT) is prescribed to almost half of all men diagnosed with prostate cancer. Although ADT is effective treatment, with virtually all men with advanced disease showing initial clinical response, it is associated with troublesome side effects including hot flushes and night sweats (HFNS). HFNS can be both frequent and severe and can have a significant impact on quality of life (QoL). They can occasionally be so debilitating that patients stop ADT altogether, despite the increased risk of disease relapse or death. Previous research has found that guided self-help cognitive behavioural therapy (CBT) can be effective in reducing HFNS due to ADT when delivered by a clinical psychologist. MANCAN2 aims test whether we can train the existing NHS Prostate Cancer Nurse Specialist (CNS) team to deliver guided self-help CBT and whether it is effective in reducing the impact of HFNS in men undergoing ADT.  Methods:   MANCAN2 is a phase III multicentre randomised controlled trial and process evaluation. Between 144 and 196 men with prostate cancer who are currently receiving ADT and are experiencing problematic HFNS will be individually randomised in a 1:1 ratio in groups of 6-8 participants to either treatment as usual (TAU) or participation in the guided self-help CBT intervention plus TAU. A process evaluation using the normalisation process theory (NPT) framework will be conducted, to understand the CNS team's experiences of delivering the intervention and to establish the key influencers to its implementation as a routine practice service. Fidelity of implementation of the intervention will be conducted by expert assessment. The cost-effectiveness of the intervention and participant adherence to the trial intervention will also be assessed.  Discussion:   MANCAN2 will advance the program of work already conducted in development of management strategies for HFNS. This research will determine whether the severity of ADT-induced HFNS in men with prostate cancer can be reduced by a guided self-help CBT intervention, delivered by the existing NHS prostate cancer CNS team, within a multicentre study. The emphasis on this existing team, if successful, should facilitate translation through to implementation in routine practice.  Trial registration:   ISRCTN reference 58720120 . Registered 13 December 2022.""","""['Simon Crabb', 'Alannah Morgan', 'Myra S Hunter', 'Evgenia Stefanopoulou', 'Gareth Griffiths', 'Alison Richardson', 'Deborah Fenlon', 'Louisa Fleure', 'James Raftery', 'Cherish Boxall', 'Sam Wilding', 'Jacqueline Nuttall', 'Zina Eminton', 'Emma Tilt', ""Alice O'Neill"", 'Roger Bacon', 'Jonathan Martin']""","""[]""","""2023""","""None""","""Trials""","""[]"""
0,0,"""https://pubmed.ncbi.nlm.nih.gov/37430206""","""http://www.ncbi.nlm.nih.gov/pmc/articles/pmc10334645/""","""37430206""","""PMC10334645""","""MiR-183-5p promotes migration and invasion of prostate cancer by targeting TET1""","""Background:   Prostate cancer (PCa) is one of the common malignant tumors worldwide. MiR-183-5p has been reported involved in the initiation of human PCa, this study aimed to investigate whether miR-183-5p affects the development of prostate cancer.  Methods:   In this study, we analyzed the expression of miR-183-5p in PCa patients and its correlation with clinicopathological parameters based on TCGA data portal. CCK-8, migration assay and invasion and wound-healing assay were performed to detect proliferation, migration and invasion in PCa cells.  Results:   We found the expression of miR-183-5p was significantly increased in PCa tissues, and high expression of miR-183 was positively associated with poor prognosis of PCa patients. Over-expression of miR-183-5p promoted the migration, invasion capacities of PCa cells, whereas knockdown of miR-183-5p showed reversed function. Furthermore, luciferase reporter assay showed TET1 was identified as a direct target of miR-183-5p, which was negatively correlation with miR-183-5p expression level. Importantly, rescue experiments demonstrated TET1 over-expression could reverse miR-183-5p mimic induced-acceleration of PCa malignant progression.  Conclusion:   Our results indicated that miR-183-5p could act as a tumor promoter in PCa and it accelerated the malignant progression of PCa by directly targeting and down-regulating TET1.""","""['Yuehua Feng', 'Kai Wang', 'Minchao Qin', 'Qianfeng Zhuang', 'Zhen Chen']""","""[]""","""2023""","""None""","""BMC Urol""","""[]"""
0,0,"""https://pubmed.ncbi.nlm.nih.gov/37430170""","""https://doi.org/10.1038/s41585-023-00799-y""","""37430170""","""10.1038/s41585-023-00799-y""","""PARP inhibitors plus enzalutamide to treat mCRPC""","""None""","""['Maria Chiara Masone']""","""[]""","""2023""","""None""","""Nat Rev Urol""","""['Talazoparib plus enzalutamide in men with first-line metastatic castration-resistant prostate cancer (TALAPRO-2): a randomised, placebo-controlled, phase 3 trial.']"""
0,0,"""https://pubmed.ncbi.nlm.nih.gov/37430169""","""https://doi.org/10.1038/s41585-023-00798-z""","""37430169""","""10.1038/s41585-023-00798-z""","""Metabolic alterations drive enzalutamide resistance""","""None""","""['Maria Chiara Masone']""","""[]""","""2023""","""None""","""Nat Rev Urol""","""['Critical role of antioxidant programs in enzalutamide-resistant prostate cancer.']"""
0,0,"""https://pubmed.ncbi.nlm.nih.gov/37428858""","""https://doi.org/10.1021/acs.jmedchem.3c00732""","""37428858""","""10.1021/acs.jmedchem.3c00732""","""Aldo-Keto Reductase 1C3 Inhibitor Prodrug Improves Pharmacokinetic Profile and Demonstrates In Vivo Efficacy in a Prostate Cancer Xenograft Model""","""Aldo-keto reductase 1C3 (AKR1C3) is overexpressed in castration-resistant prostate cancer where it acts to drive proliferation and aggressiveness by producing androgens. The reductive action of the enzyme leads to chemoresistance development against various clinical antineoplastics across a range of cancers. Herein, we report the continued optimization of selective AKR1C3 inhibitors and the identification of 5r, a potent AKR1C3 inhibitor (IC50 = 51 nM) with >1216-fold selectivity for AKR1C3 over closely related isoforms. Due to the cognizance of the poor pharmacokinetics associated with free carboxylic acids, a methyl ester prodrug strategy was pursued. The prodrug 4r was converted to free acid 5r in vitro in mouse plasma and in vivo. The in vivo pharmacokinetic evaluation revealed an increase in systemic exposure and increased the maximum 5r concentration compared to direct administration of the free acid. The prodrug 4r demonstrated a dose-dependent effect to reduce the tumor volume of 22Rv1 prostate cancer xenografts without observed toxicity.""","""['Krishnaiah Maddeboina', 'Sravan K Jonnalagadda', 'Ahmed Morsy', 'Ling Duan', 'Yashpal S Chhonker', 'Daryl J Murry', 'Trevor M Penning', 'Paul C Trippier']""","""[]""","""2023""","""None""","""J Med Chem""","""[]"""
0,0,"""https://pubmed.ncbi.nlm.nih.gov/37428241""","""https://doi.org/10.1007/s00520-023-07901-5""","""37428241""","""10.1007/s00520-023-07901-5""","""Barriers and confidence among colorectal and prostate cancer survivors participating in two behavioral intervention studies""","""Purpose:   Exercise and healthy diet are key components of cancer survivorship. We sought to explore perceived barriers to engaging in healthy diet and exercise, and whether these barriers change throughout remote-based behavioral interventions.  Methods:   Smart Pace (SP) and Prostate 8 (P8) were two 12-week pilot randomized controlled trials (RCTs) among 42 colorectal cancer (CRC) survivors and 76 prostate cancer (PC) survivors, respectively, that encouraged participants to implement exercise (both) and healthy diet (P8 only) through text messaging and wearable fitness monitors; P8 also included web materials. Participants completed surveys on perceived barriers and confidence in their ability to implement healthy behaviors at enrollment and 12 weeks; P8 also included a 52-week assessment.  Results:   At enrollment, CRC survivors commonly reported a lack of discipline/willpower (36%), time (33%), and energy (31%); PC survivors often reported a lack of knowledge about healthy dietary behaviors (26%). Not having anyone with whom to exercise with was a common barrier among both groups (21% in CRC, 20% in PC). Among the intervention groups in both studies, various enrollment barriers (overall, functional/psychological disability, aversiveness, excuses, and inconveniences) were associated with change in behavior over time.  Conclusions:   Among CRC and PC survivors, there are multiple potential barriers related to motivation, time, social support, and lack of knowledge, that can be addressed and overcome to improve healthy behaviors. Tailoring lifestyle interventions to participants' individual barriers and confidence is needed to promote and sustain behavior change long-term.""","""['Vivian N Liu', 'Kyle B Zuniga', 'Alan Paciorek', 'Li Zhang', 'June M Chan', 'Peter R Carroll', 'Katherine Van Loon', 'Angela Laffan', 'Alan Venook', 'Erin L Van Blarigan', 'Stacey A Kenfield']""","""[]""","""2023""","""None""","""Support Care Cancer""","""[]"""
0,0,"""https://pubmed.ncbi.nlm.nih.gov/37427650""","""https://doi.org/10.47391/jpma.23-45""","""37427650""","""10.47391/JPMA.23-45""","""Tumour sink effect on 68Ga-PMSA PET/CT: A case of diffuse metastatic disease of prostate cancer""","""68Ga-PMSA imaging has revolutionized both diagnosis and radioligand therapy selection in patients with metastatic prostate cancer. We report a case of a 59-year-old recently diagnosed prostate cancer with high PSA level pf >2000ng/ml referred for 68Ga-PSMA PET/CT. 68Ga-PSMA PET/CT showed diffuse intense tracer uptake throughout the axial and appendicular skeleton with significantly lower uptake of 68Ga-PSMA in normal organs in a configuration of ""tumour sink effect"". Findings are in keeping with diffuse skeletal infiltration and suspected marrow infiltration. Given the extensive nature of bone disease and pattern, 177Lu-PSMA-targetted radioligand therapy was thought to be more appropriate in a given situation with a favourable toxicity profile.""","""['Sharjeel Usmani', 'Khulood Al Riyami', 'Sofiullah Abubakar', 'Anjali Jain', 'Asiya Al Busaidi']""","""[]""","""2023""","""None""","""J Pak Med Assoc""","""[]"""
